{
  "status": "ok",
  "run_id": "github-30657159860",
  "golden_id": "golden",
  "started_at": "2026-07-31T18:56:28Z",
  "finished_at": "2026-07-31T19:21:38.095820400+00:00",
  "patches": [],
  "source": {
    "slate_version": "sha-90117dc27a56",
    "slate_commit": "90117dc27a567a1a985145d94be6b0522386eb09",
    "runner_version": "0.1.0",
    "runner_commit": "3c65d9322cb416f2a135a12978a330f189cca66b",
    "lockfile_sha256": "f92da54df0446d0ab4b64dea74fb35a82385f5058c12b1a20064bee9b700c870"
  },
  "golden_runner_commit": "c7eb0f798ee51da0c4c8bbdf1ea8f0071e3b9790",
  "resolved_configuration": {
    "balanced": {
      "scale": 1.0,
      "dataset": {
        "record_count": 300000000,
        "key_bytes": 20,
        "value_bytes": 400,
        "value_compression_ratio": 1.0
      },
      "caches": {
        "block_bytes": 8589934592,
        "metadata_bytes": 4294967296
      },
      "task": {
        "task": "balanced",
        "clients": 64,
        "warmup_ms": 300000,
        "measurement_ms": 900000,
        "initial_state": "golden",
        "key_selection": "scrambled-zipfian-0.99",
        "operation_mix": {
          "get": 0.5,
          "put": 0.5
        },
        "scan_limit": null,
        "transaction_hot_keys": null,
        "transaction_reads": null,
        "transaction_updates": null
      },
      "slate_settings": {
        "flush_interval": "100ms",
        "wal_enabled": true,
        "manifest_poll_interval": "1s",
        "manifest_update_timeout": "300s",
        "min_filter_keys": 1000,
        "l0_sst_size_bytes": 67108864,
        "max_wal_flushes_before_l0_flush": 4096,
        "l0_max_ssts": 32,
        "l0_max_ssts_per_key": 32,
        "l0_flush_parallelism": 4,
        "max_unflushed_bytes": 2147483648,
        "compactor_options": {
          "poll_interval": "5s",
          "manifest_update_timeout": "300s",
          "max_concurrent_compactions": 4,
          "enable_trivial_move": false,
          "scheduler_options": {
            "max_compaction_sources": "16"
          },
          "worker": {
            "max_concurrent_compactions": 4,
            "compactions_poll_interval": "5s",
            "heartbeat_interval": "10s",
            "max_sst_size": 268435456,
            "max_fetch_tasks": 4,
            "bytes_to_fetch": 2097152,
            "max_subcompactions": 8,
            "min_filter_keys": 1000,
            "compression_codec": null,
            "metric_level": null
          },
          "metric_level": null,
          "commit_compacted_interval": "1s",
          "worker_heartbeat_timeout": "30s",
          "object_store_max_retries": null
        },
        "compression_codec": null,
        "object_store_cache_options": {
          "root_folder": null,
          "max_cache_size_bytes": null,
          "part_size_bytes": 4194304,
          "cache_on_flush": false,
          "cache_on_compaction": false,
          "preload_disk_cache_on_startup": null,
          "scan_interval": "3600s",
          "max_open_file_handles": 1000
        },
        "garbage_collector_options": {
          "manifest_options": {
            "interval": "600s",
            "min_age": "300s",
            "dry_run": false
          },
          "wal_options": {
            "interval": "600s",
            "min_age": "300s",
            "dry_run": false
          },
          "wal_fence_options": {
            "interval": "600s",
            "min_age": "300s",
            "dry_run": true
          },
          "compacted_options": {
            "interval": "600s",
            "min_age": "300s",
            "dry_run": false
          },
          "compactions_options": {
            "interval": "600s",
            "min_age": "300s",
            "dry_run": false
          },
          "detach_options": {
            "interval": "600s"
          },
          "metric_level": null,
          "boundary_files_enabled": true,
          "object_store_max_retries": null
        },
        "metric_level": "Info",
        "default_ttl_millis": null,
        "object_store_max_retries": null
      },
      "slate_default_settings": {
        "flush_interval": "100ms",
        "wal_enabled": true,
        "manifest_poll_interval": "1s",
        "manifest_update_timeout": "300s",
        "min_filter_keys": 1000,
        "l0_sst_size_bytes": 67108864,
        "max_wal_flushes_before_l0_flush": 4096,
        "l0_max_ssts": 8,
        "l0_max_ssts_per_key": 8,
        "l0_flush_parallelism": 4,
        "max_unflushed_bytes": 1073741824,
        "compactor_options": {
          "poll_interval": "5s",
          "manifest_update_timeout": "300s",
          "max_concurrent_compactions": 4,
          "enable_trivial_move": false,
          "scheduler_options": {},
          "worker": {
            "max_concurrent_compactions": 4,
            "compactions_poll_interval": "5s",
            "heartbeat_interval": "10s",
            "max_sst_size": 268435456,
            "max_fetch_tasks": 4,
            "bytes_to_fetch": 2097152,
            "max_subcompactions": 4,
            "min_filter_keys": 1000,
            "compression_codec": null,
            "metric_level": null
          },
          "metric_level": null,
          "commit_compacted_interval": "1s",
          "worker_heartbeat_timeout": "30s",
          "object_store_max_retries": null
        },
        "compression_codec": null,
        "object_store_cache_options": {
          "root_folder": null,
          "max_cache_size_bytes": 17179869184,
          "part_size_bytes": 4194304,
          "cache_on_flush": false,
          "cache_on_compaction": false,
          "preload_disk_cache_on_startup": null,
          "scan_interval": "3600s",
          "max_open_file_handles": 1000
        },
        "garbage_collector_options": {
          "manifest_options": {
            "interval": "600s",
            "min_age": "300s",
            "dry_run": false
          },
          "wal_options": {
            "interval": "600s",
            "min_age": "300s",
            "dry_run": false
          },
          "wal_fence_options": {
            "interval": "600s",
            "min_age": "300s",
            "dry_run": true
          },
          "compacted_options": {
            "interval": "600s",
            "min_age": "300s",
            "dry_run": false
          },
          "compactions_options": {
            "interval": "600s",
            "min_age": "300s",
            "dry_run": false
          },
          "detach_options": {
            "interval": "600s"
          },
          "metric_level": null,
          "boundary_files_enabled": true,
          "object_store_max_retries": null
        },
        "metric_level": "Info",
        "default_ttl_millis": null,
        "object_store_max_retries": null
      },
      "build_profile": "release",
      "enabled_features": [
        "aws",
        "foyer",
        "wal_disable",
        "zstd"
      ]
    },
    "golden": {
      "scale": 1.0,
      "dataset": {
        "record_count": 300000000,
        "key_bytes": 20,
        "value_bytes": 400,
        "value_compression_ratio": 1.0
      },
      "caches": {
        "block_bytes": 8589934592,
        "metadata_bytes": 4294967296
      },
      "task": {
        "task": "compaction",
        "clients": 0,
        "warmup_ms": 0,
        "measurement_ms": 0,
        "initial_state": "preparation",
        "key_selection": "none",
        "operation_mix": {},
        "scan_limit": null,
        "transaction_hot_keys": null,
        "transaction_reads": null,
        "transaction_updates": null
      },
      "slate_settings": {
        "flush_interval": "100ms",
        "wal_enabled": true,
        "manifest_poll_interval": "1s",
        "manifest_update_timeout": "300s",
        "min_filter_keys": 1000,
        "l0_sst_size_bytes": 67108864,
        "max_wal_flushes_before_l0_flush": 4096,
        "l0_max_ssts": 32,
        "l0_max_ssts_per_key": 32,
        "l0_flush_parallelism": 4,
        "max_unflushed_bytes": 2147483648,
        "compactor_options": {
          "poll_interval": "5s",
          "manifest_update_timeout": "300s",
          "max_concurrent_compactions": 4,
          "scheduler_options": {
            "max_compaction_sources": "16"
          },
          "worker": {
            "max_concurrent_compactions": 4,
            "compactions_poll_interval": "5s",
            "heartbeat_interval": "10s",
            "max_sst_size": 268435456,
            "max_fetch_tasks": 4,
            "bytes_to_fetch": 2097152,
            "max_subcompactions": 8,
            "min_filter_keys": 1000,
            "compression_codec": null,
            "metric_level": null
          },
          "metric_level": null,
          "commit_compacted_interval": "1s",
          "worker_heartbeat_timeout": "30s",
          "object_store_max_retries": null
        },
        "compression_codec": null,
        "object_store_cache_options": {
          "root_folder": null,
          "max_cache_size_bytes": null,
          "part_size_bytes": 4194304,
          "cache_on_flush": false,
          "cache_on_compaction": false,
          "preload_disk_cache_on_startup": null,
          "scan_interval": "3600s",
          "max_open_file_handles": 1000
        },
        "garbage_collector_options": {
          "manifest_options": {
            "interval": "60s",
            "min_age": "300s",
            "dry_run": false
          },
          "wal_options": {
            "interval": "60s",
            "min_age": "300s",
            "dry_run": false
          },
          "wal_fence_options": {
            "interval": "60s",
            "min_age": "300s",
            "dry_run": true
          },
          "compacted_options": {
            "interval": "60s",
            "min_age": "300s",
            "dry_run": false
          },
          "compactions_options": {
            "interval": "60s",
            "min_age": "300s",
            "dry_run": false